<?xml version="1.0" encoding="UTF-8"?>
<secret xmlns="http://composestar.sourceforge.net/schema/SecretConfiguration"
	xmlns:xsi="http://www.w3.org/2001/XMLSchema-instance"
	xsi:schemaLocation="http://composestar.sourceforge.net/schema/SecretConfiguration Config/SecretConfiguration.xsd ">

	<resource name="message">
		<operation>discard</operation>
		<operation>dispatch</operation>
		<operation>exit</operation>
		<operation>return</operation>
	</resource>
	<resource name="target">
		<operation>read</operation>
		<operation>write</operation>
	</resource>
	<resource name="selector">
		<operation>read</operation>
		<operation>write</operation>
	</resource>
	<resource name="return">
		<operation>discard</operation>
		<operation>read</operation>
		<operation>write</operation>
	</resource>
	<resource name="arg">
		<operation>discard</operation>
		<operation>read</operation>
		<operation>write</operation>
	</resource>
	
	<action priority="-100">
		<!-- Matching part, always happens before a filter action can do anything -->
		<label type="transition"><![CDATA[<NameMatchingPart-any-false>]]></label>
		<label type="transition"><![CDATA[<NameMatchingPart-false-star>]]></label>
		<label type="transition"><![CDATA[<NameMatchingPart-false-true>]]></label>
		<label type="transition"><![CDATA[<NameMatchingPart-star-star>]]></label>
		<label type="transition"><![CDATA[<NameMatchingPart-star-true>]]></label>
		<label type="transition"><![CDATA[<NameMatchingPart-true-star>]]></label>
		<label type="transition"><![CDATA[<NameMatchingPart-true-true>]]></label>
		<label type="transition"><![CDATA[<SignatureMatchingPart-false>]]></label>
		<label type="transition"><![CDATA[<SignatureMatchingPart-true-star>]]></label>
		<label type="transition"><![CDATA[<SignatureMatchingPart-true-true>]]></label>
		<sequence resource="target">read</sequence>
		<sequence resource="selector">read</sequence>
	</action>
	
	<action priority="-1">
		<!-- Message substitution happens before the execution of a filter action -->
		<label type="node"><![CDATA[SubstitutedMessageAction]]></label>
		<sequence resource="target">write</sequence>
		<sequence resource="selector">write</sequence>
	</action>
	
	<action priority="1">
		<!-- The flow is changed after the filter execution -->
		<label type="node"><![CDATA[ReturnFlowAction]]></label>
		<sequence resource="message">return</sequence>
	</action>
	
	<action priority="1">
		<!-- The flow is changed after the filter execution -->
		<label type="node"><![CDATA[ExitFlowAction]]></label>
		<sequence resource="message">exit</sequence>
	</action>
	
		
	<rule resource="message" type="constraint">
		<pattern>(exit)(return|dispatch)</pattern>
		<message>Can not return or dispatch a message after an exit.</message>
	</rule>
	
	<rule resource="message" type="constraint">
		<pattern>(return)(return)</pattern>
		<message>A message can be returned only once.</message>
	</rule>
	
	<rule resource="*" type="constraint">
		<pattern>(discard)![exit]+</pattern><!-- exit is allowed for message -->
		<message>Discarded resources can not be accessed.</message>
	</rule>
</secret>
